{
  "schema_version": "amr.assessment.v2",
  "status": "reviewed",
  "source_confidence": "medium",
  "provenance": {
    "entered_by": "seed:demo",
    "entered_at": "2026-07-02",
    "last_verified_at": null,
    "changed_from_prior": null,
    "source_citation": "Demonstration State D \u2014 synthetic data generated for the SGPc testSGPc omnibus; no external source."
  },
  "jurisdiction": {
    "id": "SD",
    "name": "Demonstration State D",
    "type": "state"
  },
  "assessment_system": {
    "id": "sd-summative",
    "name": "Demonstration Summative Assessment (State D)",
    "family": "DEMO-SUMMATIVE",
    "assessment_type": "summative"
  },
  "administration": {
    "id": "sd-summative-2024",
    "year": "2024",
    "vendor": "Demonstration",
    "window": "annual"
  },
  "assessment_program": {
    "assessment_name": "Demonstration Summative Assessment (State D)",
    "abbreviation": "DEMO-D"
  },
  "comparability": {
    "administered": true,
    "scale_transition": false,
    "comparable_to_prior_year": true
  },
  "content_areas": [
    {
      "id": "MATHEMATICS",
      "label": "Mathematics",
      "vertical_scale": true,
      "scale_name": "State D Vertical Scale",
      "enrollment": {
        "intended_enrollment_grade": "fixed",
        "enrolled_grades_tested": [
          "3",
          "4",
          "5",
          "6",
          "7",
          "8"
        ],
        "note": "Demonstration enrollment: grades 3-8 tested annually."
      }
    },
    {
      "id": "READING",
      "label": "Reading",
      "vertical_scale": true,
      "scale_name": "State D Vertical Scale",
      "enrollment": {
        "intended_enrollment_grade": "fixed",
        "enrolled_grades_tested": [
          "3",
          "4",
          "5",
          "6",
          "7",
          "8"
        ],
        "note": "Demonstration enrollment: grades 3-8 tested annually."
      }
    }
  ],
  "achievement_levels": {
    "MATHEMATICS": {
      "labels": [
        "Level 1",
        "Level 2",
        "Level 3",
        "Level 4"
      ],
      "proficient_from": "Level 3"
    },
    "READING": {
      "labels": [
        "Level 1",
        "Level 2",
        "Level 3",
        "Level 4"
      ],
      "proficient_from": "Level 3"
    }
  },
  "cutscores": {
    "MATHEMATICS": {
      "3": [
        2400,
        2530,
        2650
      ],
      "4": [
        2400,
        2530,
        2650
      ],
      "5": [
        2400,
        2530,
        2650
      ],
      "6": [
        2400,
        2530,
        2650
      ],
      "7": [
        2400,
        2530,
        2650
      ],
      "8": [
        2400,
        2530,
        2650
      ]
    },
    "READING": {
      "3": [
        2400,
        2540,
        2650
      ],
      "4": [
        2400,
        2540,
        2650
      ],
      "5": [
        2400,
        2540,
        2650
      ],
      "6": [
        2400,
        2540,
        2650
      ],
      "7": [
        2400,
        2540,
        2650
      ],
      "8": [
        2400,
        2540,
        2650
      ]
    }
  },
  "scale_bounds": {
    "MATHEMATICS": {
      "3": {
        "loss": 2000,
        "hoss": 3100,
        "source": "provisional"
      },
      "4": {
        "loss": 2000,
        "hoss": 3100,
        "source": "provisional"
      },
      "5": {
        "loss": 2000,
        "hoss": 3100,
        "source": "provisional"
      },
      "6": {
        "loss": 2000,
        "hoss": 3100,
        "source": "provisional"
      },
      "7": {
        "loss": 2000,
        "hoss": 3100,
        "source": "provisional"
      },
      "8": {
        "loss": 2000,
        "hoss": 3100,
        "source": "provisional"
      }
    },
    "READING": {
      "3": {
        "loss": 2000,
        "hoss": 3100,
        "source": "provisional"
      },
      "4": {
        "loss": 2000,
        "hoss": 3100,
        "source": "provisional"
      },
      "5": {
        "loss": 2000,
        "hoss": 3100,
        "source": "provisional"
      },
      "6": {
        "loss": 2000,
        "hoss": 3100,
        "source": "provisional"
      },
      "7": {
        "loss": 2000,
        "hoss": 3100,
        "source": "provisional"
      },
      "8": {
        "loss": 2000,
        "hoss": 3100,
        "source": "provisional"
      }
    }
  },
  "cutscores_source": {
    "MATHEMATICS": {
      "3": "provisional",
      "4": "provisional",
      "5": "provisional",
      "6": "provisional",
      "7": "provisional",
      "8": "provisional"
    },
    "READING": {
      "3": "provisional",
      "4": "provisional",
      "5": "provisional",
      "6": "provisional",
      "7": "provisional",
      "8": "provisional"
    }
  }
}
