{
  "schema_version": "amr.assessment.v2",
  "status": "draft",
  "source_confidence": "low",
  "provenance": {
    "source_citation": "SGP::SGPstateData[['IN']][['Achievement']][['Cutscores']] (DBetebenner/SGPstateData; maintainer paste 2026-09-01), ELA.2026 / MATHEMATICS.2026: 2026 (new) standards expressed on the 2019 ILEARN scale via equipercentile equating (SGP_Sandbox/Indiana_2026_ILEARN_Scale_Change). Official new-scale cuts (ELA.2026.NEW_SCALE / MATHEMATICS.2026.NEW_SCALE) are commented and are for analyses reported on the new scale (>=2027), not this transition year. IDOE announced SBOE review of new cut scores on 2026-08-11 (weekly announcement); a public numeric PDF for the equated old-scale cuts was not located this session.",
    "entered_by": "ai:sgpc-harness",
    "entered_at": "2026-09-01",
    "last_verified_at": null,
    "verified_by": null,
    "changed_from_prior": "New 2026 academic standards expressed on the 2019 ILEARN scale via equipercentile equating. Score scale is unchanged; cuts moved."
  },
  "source_documents": [
    {
      "title": "SGP::SGPstateData Indiana Achievement$Cutscores (ELA.2026 / MATHEMATICS.2026)",
      "url": null
    },
    {
      "title": "IDOE Knowledge Hub weekly announcement (2026-06-12) — SBOE cut-score review 2026-08-11",
      "url": "https://idoe.atlassian.net/wiki/spaces/IKHTV/pages/2793897985/06+12+2026+Weekly+Announcement"
    },
    {
      "title": "IDOE ILEARN Cut Scores 2019 (prior scale LOSS/HOSS)",
      "url": "https://www.in.gov/doe/files/ILEARN-Cut-Scores.pdf"
    }
  ],
  "jurisdiction": {
    "id": "IN",
    "name": "Indiana",
    "type": "state"
  },
  "assessment_system": {
    "id": "ilearn",
    "name": "Indiana Learning Evaluation Assessment Readiness Network",
    "family": "ILEARN",
    "assessment_type": "summative"
  },
  "administration": {
    "id": "ilearn-in-2026",
    "year": "2026",
    "vendor": "Cambium Assessment",
    "window": "annual",
    "csem_ref": null
  },
  "assessment_program": {
    "assessment_name": "Indiana Learning Evaluation Assessment Readiness Network",
    "abbreviation": "ILEARN",
    "organization": {
      "name": "Indiana Department of Education",
      "abbreviation": "IDOE",
      "url": "https://www.in.gov/doe/"
    }
  },
  "cutscores_provenance": "SGP::SGPstateData[['IN']][['Achievement']][['Cutscores']] (DBetebenner/SGPstateData; maintainer paste 2026-09-01), ELA.2026 / MATHEMATICS.2026: 2026 (new) standards expressed on the 2019 ILEARN scale via equipercentile equating (SGP_Sandbox/Indiana_2026_ILEARN_Scale_Change). Official new-scale cuts (ELA.2026.NEW_SCALE / MATHEMATICS.2026.NEW_SCALE) are commented and are for analyses reported on the new scale (>=2027), not this transition year. IDOE announced SBOE review of new cut scores on 2026-08-11 (weekly announcement); a public numeric PDF for the equated old-scale cuts was not located this session. MAINTAINER ATTESTATION (Damian Betebenner, 2026-09-02): SGPstateData is AUTHORITATIVE for these cut scores. Its Indiana values were derived from IDOE documents and used operationally in production SGP analyses; much of that source documentation is no longer retrievable on the public web. A missing URL is therefore a documentation gap, not a provenance defect. See wiki/sources/sgpstatedata-operational-provenance.md.",
  "comparability": {
    "comparable_to_prior_year": true,
    "scale_transition": false,
    "prior_scale_name": "ILEARN ELA/Mathematics scale",
    "administered": true,
    "notes": "Score scale is still the 2019 ILEARN scale. Cuts are new-standard locations on that scale. Not a 2018→2019-style program/scale break."
  },
  "content_areas": [
    {
      "id": "ELA",
      "label": "English/Language Arts",
      "vertical_scale": false,
      "scale_name": "ILEARN ELA scale (2019; 2026 standards equated onto it)",
      "enrollment": {
        "intended_enrollment_grade": "fixed",
        "enrolled_grades_tested": [
          "3",
          "4",
          "5",
          "6",
          "7",
          "8"
        ],
        "note": "ISTEP / ISTEP+ / ILEARN tested grades start at 3. The filed-not-fixed grade-encoding-split analysis (K vs 0) does not apply."
      }
    },
    {
      "id": "MATHEMATICS",
      "label": "Mathematics",
      "vertical_scale": false,
      "scale_name": "ILEARN Mathematics scale (2019; 2026 standards equated onto it)",
      "enrollment": {
        "intended_enrollment_grade": "fixed",
        "enrolled_grades_tested": [
          "3",
          "4",
          "5",
          "6",
          "7",
          "8"
        ],
        "note": "ISTEP / ISTEP+ / ILEARN tested grades start at 3. The filed-not-fixed grade-encoding-split analysis (K vs 0) does not apply."
      }
    }
  ],
  "achievement_levels": {
    "ELA": {
      "labels": [
        "Below Proficiency",
        "Approaching Proficiency",
        "At Proficiency",
        "Above Proficiency"
      ],
      "proficient_from": "At Proficiency"
    },
    "MATHEMATICS": {
      "labels": [
        "Below Proficiency",
        "Approaching Proficiency",
        "At Proficiency",
        "Above Proficiency"
      ],
      "proficient_from": "At Proficiency"
    }
  },
  "cutscores": {
    "ELA": {
      "3": [
        5356,
        5460,
        5547
      ],
      "4": [
        5395,
        5491,
        5595
      ],
      "5": [
        5419,
        5521,
        5623
      ],
      "6": [
        5443,
        5543,
        5640
      ],
      "7": [
        5458,
        5559,
        5657
      ],
      "8": [
        5473,
        5574,
        5671
      ]
    },
    "MATHEMATICS": {
      "3": [
        6356,
        6426,
        6534
      ],
      "4": [
        6412,
        6469,
        6579
      ],
      "5": [
        6443,
        6509,
        6603
      ],
      "6": [
        6471,
        6544,
        6640
      ],
      "7": [
        6469,
        6562,
        6657
      ],
      "8": [
        6476,
        6591,
        6694
      ]
    }
  },
  "cutscores_source": {
    "ELA": {
      "3": "derived",
      "4": "derived",
      "5": "derived",
      "6": "derived",
      "7": "derived",
      "8": "derived"
    },
    "MATHEMATICS": {
      "3": "derived",
      "4": "derived",
      "5": "derived",
      "6": "derived",
      "7": "derived",
      "8": "derived"
    }
  },
  "scale_bounds": {
    "ELA": {
      "3": {
        "loss": 5060,
        "hoss": 5760,
        "source": "official",
        "notes": "LOSS/HOSS from IDOE ILEARN Cut Scores PDF (updated 2019-08-26)."
      },
      "4": {
        "loss": 5090,
        "hoss": 5810,
        "source": "official",
        "notes": "LOSS/HOSS from IDOE ILEARN Cut Scores PDF (updated 2019-08-26)."
      },
      "5": {
        "loss": 5110,
        "hoss": 5850,
        "source": "official",
        "notes": "LOSS/HOSS from IDOE ILEARN Cut Scores PDF (updated 2019-08-26)."
      },
      "6": {
        "loss": 5130,
        "hoss": 5870,
        "source": "official",
        "notes": "LOSS/HOSS from IDOE ILEARN Cut Scores PDF (updated 2019-08-26)."
      },
      "7": {
        "loss": 5130,
        "hoss": 5890,
        "source": "official",
        "notes": "LOSS/HOSS from IDOE ILEARN Cut Scores PDF (updated 2019-08-26)."
      },
      "8": {
        "loss": 5150,
        "hoss": 5920,
        "source": "official",
        "notes": "LOSS/HOSS from IDOE ILEARN Cut Scores PDF (updated 2019-08-26)."
      }
    },
    "MATHEMATICS": {
      "3": {
        "loss": 6080,
        "hoss": 6730,
        "source": "official",
        "notes": "LOSS/HOSS from IDOE ILEARN Cut Scores PDF (updated 2019-08-26)."
      },
      "4": {
        "loss": 6100,
        "hoss": 6800,
        "source": "official",
        "notes": "LOSS/HOSS from IDOE ILEARN Cut Scores PDF (updated 2019-08-26)."
      },
      "5": {
        "loss": 6110,
        "hoss": 6850,
        "source": "official",
        "notes": "LOSS/HOSS from IDOE ILEARN Cut Scores PDF (updated 2019-08-26)."
      },
      "6": {
        "loss": 6110,
        "hoss": 6870,
        "source": "official",
        "notes": "LOSS/HOSS from IDOE ILEARN Cut Scores PDF (updated 2019-08-26)."
      },
      "7": {
        "loss": 6120,
        "hoss": 6920,
        "source": "official",
        "notes": "LOSS/HOSS from IDOE ILEARN Cut Scores PDF (updated 2019-08-26)."
      },
      "8": {
        "loss": 6120,
        "hoss": 6950,
        "source": "official",
        "notes": "LOSS/HOSS from IDOE ILEARN Cut Scores PDF (updated 2019-08-26)."
      }
    }
  },
  "notes": "2026 transition: scores in the Indiana LONG remain on the 2019 ILEARN scale (5000s/6100s); cuts are the new standards mapped onto that scale. Four-level labels match 2021–2025. Grade 10 cuts in SGPstateData (244/292, 271/339) are ISTEP+ Grade 10 leftovers and are not applied. Official new-scale cuts are not used here. ISTEP / ISTEP+ / ILEARN tested grades start at 3. The filed-not-fixed grade-encoding-split analysis (K vs 0) does not apply."
}
